title,artist,creator,tags,num_timing_points,num_uninherited_points,mp3_duration_seconds,song_name,variation_rating_uninherited
Hey William (New Translation),Omoi,Saoji,ファーストワルツ The First Waltz vocaparty vocalsynth shin yaku shinyaku fa featured artist osu! hatsune miku vocaloid synth rock electronic nee neonat okoratu okorin 初音ミク captin1 Noffy Yooh Garden mappers' guild mapper's mpg japanese ボーカロイド Smokeman net0 Yales Reywateil,141,17,252.02938775510205,1409184,0.0634846600331675
Roskill Lavender,YUZUKINGDOM,Nao Tomori,ryu blood stain child q'ulle genesis king single metalcore japanese rock metal icekalt pishifat yugu lasse,43,2,247.04,1410727,0.0040479274611398
Kimi no Sei,the peggies,toybot,Rascal Does Not Dream of Seishun Buta Yarou wa Bunny Girl Senpai no Yume wo Minai AoButa vikala Kalibe Luscent PaRaDogi Seolv [_L_u_k_a_s_] uwu jpop j-pop japanese pop anime,118,6,264.6666666666667,1415985,0.0188916876574307
theyaremanycolors,Frums,Ancelysia,ancel THE BMS OF FIGHTERS ULTIMATE 2017 semicolon breakcore densecore frenchcore speedcore psycore hard rave dark psytrance trance experimental therearemanycolors therearemanycolours theyaremanycolours they there are many colors colours tamc frums.xyz frumsdotxyz electronic instrumental featured artist fa vanchanical dementation ancul skubi cptsqbany,127,13,162.580625,1416051,0.0738095329624917
Listen!! (TV Size),HO-KAGO TEA TIME,Azunyan-,K-ON!! Season 2 Two ending ED Japanese rock pop anime j-pop j-rock 平沢唯 Hirasawa Yui 豊崎愛生 Toyosaki Aki 秋山澪 Akiyama Mio 日笠陽子 Hikasa Yoko Youko 田井中律 Tainaka Ritsu 佐藤聡美 Satou Satomi 琴吹紬 Kotobuki Tsumugi 寿美菜子 中野梓 Nakano Azusa 竹達彩奈 Taketatsu Ayana short size length version Vicho Vicho-kun Melophobia Mafiamaster kusano Yogurtt Some Hero Nyukai keeVY Mayu Sakuma Xexyz,57,5,92.57526077097506,1416174,0.043208087848607
Asterlore (Game Ver.),Suzuki Konomi,Lize,Opening Key Visual Novel VN Japanese Pop J-Pop Jpop Video Game Garden Necho Skystar 魁 Kai 折戸伸治 Orito Shinji 塚越雄一朗 Tsukagoshi Yuichiro NanosizeMir visualarts arts galgame version サマーポケッツ Amamiya Yuko,24,10,136.53333333333333,1418402,0.06591796875
Children Record (Re:boot),JIN,Nevo,vocaloid reboot kagerou project 10 year anniversary カゲロウプロジェ 自然の敵P Shizen no Teki P Teki-P TekiP seto kousuke hypercyte [arc] makidonalds cycopton wanpachi narrative dragontail rock japanese remaster jrock j-rock 初音ミク hatsune miku,41,6,187.5591836734694,1419430,0.0266582520891364
Black Rover,Vickeblanka,Keqing,iljaaz elinor pepe pepekcz fuju yudragen chaoticred djulus -mikanmymommy sing milan- kalibe handsome hehe clover op opening full japanese anime asta jrock rock,266,48,209.6065306122449,1419615,0.224229654785643
Duvet,boa,Gibune,Fuju Akito rock pop english anime opening op,95,57,202.22666666666663,1424150,0.2769169908353662
Dokuhaku,Sakamoto Maaya,Kalibe,内澤崇仁 坂本真綾 rock jrock japanese skyflame anime ending full version fate grand order movie Shinsei Entaku Ryouiki Camelot 1,300,46,282.62666666666667,1426532,0.1592206444308156
Veracila,DUAL ALTER WORLD,Hinsvar,ALTER EGO Japanese Metal Rock J-Metal JMetal J-Rock JRock 小岩井ことり Koiwai Kotori RYU Featured Artist FA Mappers' Guild MPG,31,3,237.84489795918367,1428384,0.0084088412959912
3-pun 29-byou (TV Size),hitorie,Saggin,japanese anime rock jrock j-rock opening op eighty-six godkei sanairrt 3:29 3 minutes 29 seconds 86,22,5,90.072,1428768,0.0444089173105959
Yume o Kakeru! (TV Size),Spica,Huzz,tv anime japanese uma musume pretty derby season two 2 opening theme op jrock j rock horse girls animation cygames zan zan1to severon スペシャルウィーク special week 和氣あず未 waki azumi ajuju サイレンススズカ silence suzuka 高野麻里佳 kouno marika トウカイテイオー tokai teio machico toukai teiou ウオッカ vodka 大橋彩香 ohashi ayaka ダイワスカーレット daiwa scarlet 木村千咲 kimura chisa ゴールドシップ gold ship 上田瞳 ueda hitomi メジロマックイーン mejiro mcqueen 大西沙織 onishi saori oonishi マイクスギヤマ mike sugiyama 東大路憲太 higashiooji kenta team,78,2,91.248,1430235,0.0109591443100122
Nouri Ue no Cracker,ZUTOMAYO,Woood13,zuto jpop j-pop j pop shii shiitsuin japanese Zutto Mayonaka de Ii no ni. Hisohiso Banashi Tadashii Itsuwari Kara no Kisho 焦茶,165,12,269.94938775510207,1432232,0.0407483791368298
Towa yori Towa ni,marina,Garven,Kite KSHR Cilvery Melophobia TKSalt Shoujo Shiniki Tengoku,97,8,152.17743764172334,143370,0.0459989345889785
GO CRY GO (TV Size),OxT,NeKroMan4ik,overlord ii 2nd op opening anime jrock rock japanese -mikanmymommy djulus irohas mugiwarasekai fuju airincat,172,4,89.5434693877551,1434136,0.0335032808144716
Foul Play ni Kurari,Wakeshima Kanon,IOException,deadcode ceo of osu ceo_of_osu to love ru japanese anime darkness ed ending full pop jpop j-pop jp orchestra orchestral,222,17,269.4269387755102,1435798,0.0593853015318983
Mezameta Asa ni wa Kimi ga Tonari ni (TV Size),Suzuyu,Kawaiwkyik,happy623 Awaken ending,54,22,109.45308333333334,143812,0.1918630280706269
Clattanoia (TV Size),OxT,Nelliel,jrock overlord op opening japanese anime masayoshi ooishi kowari blitzifyyy Hello New World j-rock rock Ōishi Tom-H@ck Tom-Hack hotaru Season 1 one 大石昌良,147,100,90.144,1438655,1.0982428115015974
3-pun 29-byou (TV Size),hitorie,Ohwow,opening op japanese anime 86 eighty six eighty-six rock jrock j-rock 3:29 3 minutes 29 seconds,107,7,90.07335416666666,1438780,0.0666123744975449
Aozora Jumping Heart,Aqours,A r M i N,Armin A_r_M_i_N Kuki1537 Elinor [_Eli_] Eli Didah Kujinn Reform japanese pop j-pop jpop Lovelive Love Live Sunshine Sailing to the『ラブライブ！サンシャイン!!』TVアニメ オリジナルサウンドトラック,96,3,284.4734693877551,1440165,0.0070305325987144
Swiper No Swiping!,Joshua Sitron & Billy Straus,Gordon,English Novelty Children's Music The Fox Swiper's Theme Boots The Monkey Nickelodeon Jr Nick Jr. Cartoon TV Television Latin Polyrhythm Records Paramount Dora the Explorer (Album) 2004 Costa Rica Marc Weiner Kathleen Herles Harrison Chad Leisha Medina Gordon123 StarCastler -ascended- -_ascended_- ascended AJT,57,15,46.158367346938775,1440219,0.3033036219581211
refrain,dj TAKA feat. AiMEE,Firika,Oiso Nemodoko thanh_nemo video game electronic English trance beatmania IIDX 23 copula REFLEC BEAT plus MUSIC PACK 71 bemani konami Takayuki Ishikawa 石川貴之,129,2,122.29331065759636,1440543,0.008177062135474
SAVE (Encore),DM DOKURO,browiec,deltarune remix radiation original soundtrack The Underground Radio toby fox drum n and bass chiptune sans ost electronic video game instrumental square last goodbye determination Reform Kujinn Fatfan Kolek kuki1537,113,57,138.45201814058956,1440767,0.4044722550966027
Heroine Ikusei Keikaku feat. Suzumi Hiyori (CV: Minase Inori),HoneyWorks,sanairrt,好きすぎてやばい。〜告白実行委員会キャラクターソング集〜 hiroin suki sugite yabai kokuhaku jikkou iinkai Character Song Shu Japanese pop jpop j-pop ハニーワークス ハニワ Haniwa Premium Live プレミアムライブ ハニプレ arronchu1207 Oriental not dt farmer,85,2,219.8726530612245,1441554,0.0045480872044671
LADYBUG,Ryokuoushoku Shakai,RLC,japanese pop jpop j-pop ryokushaka リョクシャカ rock jrock j-rock 結証 yui shou yui-shou kesshou keshou track 2 #2 2021 長屋晴子 小林壱誓 peppe 穴見真吾 Haruko Nagaya Issey Issei Kobayashi Shingo Anami green yellow green-yellow society,25,4,235.28,1441587,0.0127507650459027
Contemplation in Snow,Yu-Peng Chen @HOYO-MiX,- ascended -,純白での瞑想 阿贝多 原神 albedo Kreideprinz chalk prince Theme The Stellar Moments Mihoyo OST original sound track soundtrack video game videogame instrumental electronic gacha Mondstadt Geo Princeps Cretaceus -ascended-,85,37,122.8649433106576,1442494,0.2930046523439634
Newlove,Sewerslvt,DTM9 Nowa,Nuvolina fa featured artist dnb drum and bass breakcore trance sewerslut Draining Love Story Electronic instrumental,67,29,359.3404081632653,1442626,0.0779205437627217
Sekai Gofun Go Shinwa feat. mami,UKRampage,ScubDomino,ＯＤＹＳＳＥＹ 4580617350034 The 5 minute mythology ft. featuring sasakure.UK ささくれP sasakureP sasakuration ササクレイション  mamiとm@sumi mamitomasumi ayakashigirl 佐々木秀尚 Sasaki Hidehisa hidehisa_guitar 二家本亮介 Ryosuke Nikamoto chan_nika116 chan-nika 今井義頼 Yoshinori Imai yoshinoridrums 岸田勇気 Kishida Yuki natsume shiki anime girl natsume_shiki anime_girl scub domino scub_domino jungkyuyoung [keqing] 8972308 kalibe kalbi 3376777 lcfc lowcombofc haroderm13 -[H13]- 7322726 wind__worker windworker 互绘*2 百塩茶 月魂zukikon 月魂 japanese j-rock rock jrock jazz fusion vocal,212,35,300.0003628117914,1443200,0.1133331962712668
Daemonisch,TUYU,Keqing,devilish dämonisch demonish bongo guanineso stratos iljaaz -aqua captin1 ajisai- Woood13 SnowNiNo_ frozz -Keqing kazato asa shikibe mayu shizuku- pusu ぷす omutatsu おむたつ jpop j-pop japanese pop female vocals,79,7,160.968,1443294,0.037274489339496
Daemonisch,TUYU,Orange_,dämonisch demonish ぷす omutatsu おむたつ jpop j-pop japanese pop female vocals Ferdeza Battle shokolatte - Frontier - Half Lully,478,7,160.968,1445696,0.037274489339496
Toaru Shoukoku no Ohimesama ga...,nao,Allice,"calliecube obamacube smokebloke karcher [karcher] m_i_x mix paradogi usaha nana abe takekii hanasaka yui とある小国のお姫様が、会ったこともない兄の家にやってきて住みついた事情。 demetori 寺前甲 maya 山下慎一狼 princess sugar eroge himesama love life camo camocratic japanese rock jrock j-rock Toaru Shoukoku no Ohimesama ga, Atta koto mo nai Ani no Ie ni yattekite Sumitsuita Jijou.",266,2,247.22285714285715,1450155,0.0040449334319526
Kagerou (TV Size),ReaL,Zekao,銀魂。 gintama season 5 2017 period full stop final terminal japanese anime opening op 18 リアル Synaelle Shiyzo AlBA- jrock j-rock rock,35,24,89.96571428571428,1450366,0.2556529471544715
The Office Theme (TV Size),The Scrantones,IsomirDiAngelo,pop rock instrumental jay ferguson nbc thats tv show opening american usa comedy dunder mifflin paper jim halpert pam beesley michael scott dwight kurt schrute bears beets battlestar galactica,14,9,32.3134375,1451284,0.2475750220012959
Ashiato (TV Size),the peggies,Seolv,my hero academia boku no mha ed ending 8 footprints season 5 jpop jrock j-rock j-pop japanese anime kalibe haruto haruto_aizawa hazu- aistre alphabet venax lukas [_l_u_k_a_s_] wanpachi cycopton,26,8,89.7708163265306,1451291,0.0779763433869013
The Decisive Battle with the Fugitives,S.S.H.,sjoy,Crea-Tech kamisamaaa Aakiha Kawaiwkyik SSH final fantasy vi Metal Max series,42,7,246.11125,145215,0.0243792187476192
Drown,milet,AirinCat,vinland saga anime ending 2 two second 2nd japanese english pop jpop eyes,81,9,213.8383673469388,1452528,0.0374114341558758
Letter From Ajax,Yu-Peng Chen @HOYO-MiX,- ascended -,アヤックスからの返信 Dimeng Yuan mihoyo tartaglia hydro snezhnaya gacha childe character demo theme ost soundtrack the stellar moments videogame video game original rock instrumental mildly accurate mildy_accurate some hero some_hero aistre alphabet venax farewell of 陳致逸 Zhiyi Chen Ayakkusu kara no henshin Ai A Si De huixin 米哈游 原神 达达利亚 達達利亞 公子 阿贾克斯 fatui harbinger,124,4,93.25925170068028,1456207,0.0321683902164327
POWER,Kanye West,M i X,thexo hakashii mix m_i_x hip hop english progressive rap my beautiful dark twisted fantasy radio edit 21st century schizoid man king crimson,156,13,102.53061224489797,1456297,0.1170382165605095
Ashita o Narase,Shishido Kavka,elicz1,zelq AirinCat FuJu japanese wo rock jp j-pop pop jpop j-rock jrock avex single anime ft fairy tail ZERO 0 ゼロ 2014 フェアリーテイル tale opening 22 season eight 8 s8 natsu ナツ dragneel ドラグニル zeref ゼレフ mavis メイビス vermillion ヴァーミリオン,129,23,203.5461224489796,1457607,0.1080836113963039
3-pun 29-byou,hitorie,Ryuusei Aika,japanese rock j-rock jrock Mocaotic Ducky- Stormiverse Flake Deca Fixxis Black Man Airiesu Mujina 3 san bun min 29 nijyuukyuu byou sec 86 eighty six eighty-six male vocal anime opening op イガラシ Igarashi シノダ Shinoda ゆーまお Yuumao,49,4,209.345306122449,1457787,0.0143303905665086
One In A Billion,"Wake Up, May'n!",Yogurtt,Isekai Shokudo restaurant from another world may'n mayn wake up girls anime opening op full japanese pop jpop jp rizia kawaiwkyik meg image-- meyrink kalibe,50,3,257.72408333333334,1459427,0.0077602371269791
Hollywood's Bleeding,Post Malone,PaRaDogi,hip hop undeadphoneguy alphabet venax tricolor shiinoha kotone unappreciative harepascals koda delusional gygy altai aistre mynt Tomadoi pop english america hiphop rap,119,6,156.29061224489797,1462762,0.0319916847735249
give it back (TV Size),Co shu Nie,Rosiie,guanineso wanpachi cycopton xahlt japanese jrock j-rock rock female vocals vocalist jujutsu kaisen sorcery fight 2 2nd second anime ed ending 黒 Poulet Roti! たえ,68,23,90.12,1463434,0.2441189525077674
THE DAY,NateWantsToBattle,Smoke,ポルノグラフィティ Porno Graffitti Cover boku no hero academia my op opening tv english rock anime sajinn,140,2,95.088,1464434,0.0105165741208144
Yoru ni Kakeru (Ryox Remix),YOASOBI,Ducky-,幾田りら Ikuta Rira Lilas instrumental racing into the night Ayase Iphone Ringtone Electronic,11,4,40.33297916666667,1464608,0.074380818426608
Poker Face,Eric Cartman,Larto,Trey Parker Lady Gaga Pokerface Wales Whales,18,5,214.77875,14672,0.0186238163691705
Sports (Cut Ver.),Beach Bunny,Shime,indie rock pop power punk emo alternative english female vocals vocalist astrolis sirmirai cacturne mirai le le_mirai ryxliee short version,129,68,71.00416666666666,1468480,0.9436065958570506
Dawn Blue,Mori Calliope,Cynplytholowazy,cover corporation hololive production alternative holoalt ホロライブプロダクション ホロライブ オルタナティブ japanese pop jpop j-pop vtuber virtual youtuber バーチャル ユーチューバー holoen english holomyth dead beats デッドビーツ 森 カリオペ 森美声 もりかりおぺ ボンジュール鈴木 Bonjour Suzuki 高橋 浩一郎 Kouichiro Takahashi 鈴木Daichi秀行 Hideyuki Daichi teaser pv promotional video -Atri- Firis Mistlud Firis_Mistlud KuranteMelodii krt Mir frozz Wanpachi fedora fedora- Yuuki_Noa Yuuki Noa,155,8,108.49297916666669,1469465,0.0645203040212087
Amanita,Marmalade butcher,Camo,mao zelq deviouspanda asaben asa olsonn megafan paradogi nullum sonum ヌルムソヌム instrumental math rock fa featured artist o!wc owc owc2020 finals hd1,98,15,209.78938775510204,1473778,0.0667335948200722
rose,ANNA TSUCHIYA inspi' NANA(BLACK STONES),Some Hero,PandaHero anime opening op full version ver japanese english rock j-rock jrock ayumi miyazaki mad pray records i need your love,181,27,229.16024943310657,1474104,0.1134577225514391
Akui to Ai no Sukima no Puzzle,iojjj,Okoratu,Diabolic Theater Esper Gakuen Sumii Umineko no Naku Koro ni Ushiromiya Maria Midori Akuma Gekijou えすぱー学園 すみー 右代宮真里亞 緑 悪魔の劇場,100,19,254.92897959183676,147430,0.0706079003996311
Mirage,sokoninaru,AirinCat,fuju rock jrock j-rock japanese 超越 chouetsu choetsu 斎藤翔斗 Syouto Saito 藤原美咲 Misaki Fujiwara 鈴木重厚 Juko Suzuki,104,20,186.07020408163265,1474917,0.1021119963498525
Lucid Dreams (Remix) feat. Lil Uzi Vert,Juice WRLD,1103,goodbye & good riddance english hip hop rap riffy bakari qiyana clubber washedup player dyl-byl shape of my heart sting ft. wont,95,86,240.4373015873016,1475832,0.3535225168426577
Clattanoia (TV Size),OxT,fieryrage,overlord anime opening op 大石昌良 masayoshi oishi 大嶋文博 tomohiro oshima tom-h@ck tom hack hello new world japanese english rock browiec dashyy- flask erisu mayuzumi fuyuko kuki1537 glaceon,227,100,90.144,1476842,1.0982428115015974
good 4 u,Olivia Rodrigo,hehe,pop punk for sour isabel rock english marianna toybot vikala,35,21,198.58285714285716,1477257,0.1007136279926335
Spiral,KANA-BOON,Nevo,nine tail fox bijuu dama rasengan sage of six paths Ultimate Ninja Storm 4 no jutsu shippuuden shipuuden shippuden kanaboon kana-boom kanaboom hokage kage shadow Tailed Beast Super Ultra Rasenshuriken Jutsu Technique video game anime shounen japanese rock cut version short ost soundtrack edit jrock j-rock 谷口鮪 Taniguchi maguro opening cutscene trailer road to boruto dlc,15,2,92.49557823129253,1477925,0.0108113276236775
BAKU (TV Size),Ikimonogakari,Smoke,anime pop jpop j-pop rock jrock j-rock japanese uzumaki boruto Kuki1537 Nymphe Kiyoshi Guarden 吉岡聖恵 Kiyoe Yoshioka 山下穂尊 Hotaka Yamashita 水野良樹 Yoshiki Mizuno op opening 8,283,131,89.84041666666667,1479509,1.4470102079149605
Haikei Doppelganger,Matsushita,gazimal,cover japanese rock vocaloid GUMI AdveNt wring Dear Doppelganger KEMU VOXX 堀江晶太 Horie Shota,320,6,267.2206575963719,1481802,0.0187111282674572
Ahoy!! Warera Houshou Kaizokudan*,Houshou Marine,Luscent,IOSYS ARM japanese pop jpop j-pop electronic Amateurre wanpachi toybot vikala vtuber virtual youtuber ホロライブ hololive まろん maron 三輪紫乃 miwa shino しばやん shibayan hoshou captain senchou ahoy,101,2,112.00056689342404,1482982,0.0089285262364034
Kessen Spirit,CHiCO with HoneyWorks,Hinae,haikyu!! haikyuu!! season 4 ending ed full version japanese volleyball anime rock jrock j-rock spy_ro spyro,107,6,271.08,1484429,0.0184447395602774
Vanity Clock,love solfege,Chizu-Kun,neoclassical experimental japanese pop jpop j-pop reception for witnesses leomineXD featured artist fa 鮎 Ayu 紺野比奈子 Hinako Konno オーギュスト棒 Auguste Stick solfège,162,9,255.50367346938776,1486643,0.0313107044269502
GIRLS' LEGEND U,Various Artists,Yuuma,uma musume pretty derby op opening japanese anime pop jpop j-pop cygames special week waki azumi silence suzuka kouno marika tokai teio machico maruzen ski lynn oguri cap takayanagi tomoyo gold ship ueda hitomi vodka ohashi ayaka daiwa scarlet kimura chisa taiki shuttle otsubo yuka glass wonder maeda reina mejiro mcqueen onishi saori el condor pasa takahashi minami symboli rudolf tadokoro azusa air groove aoki ruriko mayano top gun hoshitani mio mejio ryan hashi afumi rice shower iwami manaka agnes tachyon uesaka sumire wining ticket watanabe yui sakura bakushin o misawa sachika super creek yuuki kana haru urara shutou yukina machikanefukukitaru nitta hiyori nice nature maeda kaori king halo saeki iori,119,9,291.1608163265306,1486797,0.0274762246545846
wasurena feat. Sennzai,tokiwa,Mocaotic,featured artist fa mappers' guild mpg future bass 常盤 electronic japanese vocals edm oriental,27,4,207.3218820861678,1496234,0.0144702525841103
Yume o Kin'iro ni Somete,Co shu Nie,Nymphe,Moete Keqing iljaaz kujinn reform kiyoshi guarden japanese rock jrock j-rock female vocal LITMUS Nakamura Miku Matsumoto Shunsuke Fujita Ryosuke Golden Dream,142,12,125.29333333333334,1496416,0.0877939768011067
good 4 u,Olivia Rodrigo,Seolv,sour english pop rock paramore misery business lukas [_l_u_k_a_s_] muya- haruto haruto_aizawa jas craezy some hero for you,541,10,178.20734693877552,1500436,0.0505029683377308
BOYS & GIRLS (TV Size),LM.C,Pepekcz,FlyzyStyle Didah katekyo katekyou hitman reborn opening 2 second neo vongola famiglia decimo 沢田綱吉 Sawada Tsunayoshi rock j-rock jrock japanese anime vocal male,79,4,89.417125,1501123,0.0335506201971937
DiViNE (TV Size),EXiNA,eiri-,Ayyri honne BlastTheKidd fieryrage Alexsander browiec Esu Esutarosa Sarawatlism C O N N E R C_O_N_N_E_R [ Lost ] [_Lost_] Anime Japanese Rock J-Rock JRock Zero Mio ブルーリフレクション零/レイ Opening,16,2,91.89464852607708,1502283,0.0108820264948967
Emo Hardcore,LIDA x FRIK PATI,Nuvolina,russian electronic Жабы атаковали планету Земля Toads Attacked the Earth Planet pw384 log off now log_off_now,76,15,139.85591836734693,1502812,0.1001030214769135
Brave Freak Out (TV Size),LiSA,Aakki,anime japanese rock j-rock jrock female vocalist qualidea code op opening risa oribe agatsu dog food xchippy Chizuru xiced door weapon nymphe kiyoshi guarden kujinn reform xandit,96,7,92.86530612244898,1504180,0.0646097046413502
MAKE A LOSER (inst),Nanahoshi Kangengakudan,Keqing,iljaaz yudragen chaotic_red amateurre pile some hero heroine meikaruza Iron Quality MONSTER BEERGARDEN jazz fujun isei kouyuu p fujuniseikouyuup 不純異性交遊p instrumental,103,9,231.49714285714285,1504828,0.0345576619273301
ADAMAS (TV Size),LiSA,Xahlt,adinda sajinn wanpachi cycopton kuon- sao sword art online III 3 alicization season female vocal japanese jrock j-rock rock pop j-pop jpop opening op anime ost original soundtrack 草野華余子 kayoko kusano 赤い罠 Akai Wana (who loves it?),51,5,89.49551020408163,1505910,0.0446949795680093
Bard's Adventure,Yu-Peng Chen @HOYO-MiX,- ascended -,-ascended- video game videogame folk instrumental 詩人の仕事 原神 venti anemo archon god character theme song monstadt ballads ballad in goblets goblet lyre femboy mihoyo Theme The Stellar Moments OST original sound track soundtrack gacha Mondstadt Carmen Dei,112,37,107.02492063492063,1507424,0.3363702564452427
Miniascape,Natsume Itsuki,-Aqua,featured artist fa mappers' guild mpg CodeQ Code Q 4th album fourth Japanese Classical Full Version satella violin MISSILE228,161,12,253.36163265306124,1509856,0.0434162027013094
The Snow White Princess is,cillia,theramdans,シリア harumia ボカロ ボーカロイド Shiroi Yuki no Princess wa vocaloid feat. vocaloid3 のぼる↑P 江藤昇 etou noboru 初音ミク meiko power v3 kyaami hatsune miku crypton future media noboru-p japanese rock jrock j-rock jpop j-pop pop cover -Foxee- Foxee Runigh,152,2,262.32,1509983,0.0038121378469045
My Girlfriend is a Raver,S3RL x LIDA,Aakki,lean monster dog food xiced door weapon dtm9 nowa nowaie lugu omtereston tritobandito xandit shirahane suou iceluin русский english happy hardcore serl russian electronic лида моя тёлка телка рейв танцор moya telka tyolka reiv tantsor tancor,130,54,223.76489795918368,1511331,0.236855737800607
brutal,Olivia Rodrigo,Haruto,SOUR album pop punk rock english dan nigro kieg haruto_aizawa appleeaterx mint seolv [_l_u_k_a_s_] lukas enri,210,16,143.9869387755102,1512125,0.1041761157474601
Gamushara (TV Size),CHiCO with HoneyWorks,Aakki,anime pop j-pop jpop rock j-rock jrock japanese opening uzumaki boruto naruto uchiha sasuke kuki1537 a_r_m_i_n shirahane suou armin,36,3,90.12244897959184,1513125,0.0221920289855072
Gamushara (TV Size),CHiCO with HoneyWorks,Smoke,anime pop j-pop jpop rock j-rock jrock japanese opening uzumaki boruto naruto uchiha sasuke PikAqours Nymphe Kiyoshi Guarden Reform Kujinn torriru,59,3,90.12244897959184,1513461,0.0221920289855072
Untitled world,ReoNa,GodKei,Arknights アークナイツ Japanese Video Game gacha アンタイトル ワールド 草野 華余子 (LIVE LAB.) 毛蟹 Akita Horie 堀江晶太 rock jpop j-pop pop j-rock short cut version レオナ yostar hypergryph,29,22,90.288,1514170,0.232589048378522
Welcome to the Internet,Bo Burnham,[-Evil-],Mimari Shime Crowley Dab Instrumental Polka Stand-up Musical Novelty English Comedy Standup Netflix i love ganyu i_love_ganyu,358,74,276.0620416666667,1520101,0.2644333120166677
Levitator,Satyr,IllusionB,alternative english progressive math rock alt metal locus stream fast zoli itswinter silence player lmt flake zetera,242,25,204.75,1520317,0.1172161172161172
Senkou,[Alexandros],AdveNt,mobile suit gundam Hathaway's_Flash Hathaway rock j-rock jrock japanese Yoohei Kawakami 川上 洋平 Hiroyuki Isobe 磯部 寛之 Masaki Shirai 白井 眞輝 Satoyasu Shomura 庄村 聡泰,207,28,265.50857142857143,1521689,0.1016916322314049
Additional Memory,JIN,Ilay,Japanese Reload Rock Ayano Tateyama 楯山文乃 Kagerou Project Daze Days Mekakucity Actors メカクシティアクターズ Shizen no Teki P Teki-P TekiP 自然の敵P Vocaloid Hatsune Miku 初音ミク moph Len Fast JRock J-Rock,217,5,239.934693877551,1521890,0.0166712030484485
Gyakkou,Soushi Sakiyama,Gillstar,gills fixxis black man toybot vikala amity myxo myxomatosis japanese pop j-pop rock j-rock male vocal Kakegurui Twin ending ed,105,11,167.2,1523018,0.0598086124401913
Hikari yo,KikuoHana,SMOKELIND,O Light Hanatan 花たん YURiCa  ユリカ 第一幕 1 First Act Daiichi Maku Japanese JRock J-Rock Rock Hey lululu Nymphe Kiyoshi Guarden,487,20,277.96,1524556,0.0683551590156857
Tokyo Wonder.,Nakimushi,Emiru Ikuno 11,東京卍會 nakimusi wo manji-kai manji kai tokyo revengers single full ver jp japanese anime rock jrock j-rock male vocal ed ending 2 cry baby abelia mrowswares apollo apo11o,23,5,149.832,1524658,0.0266965668215067
Ohayou !,Thaehan,Chanmann,featured artist Loki bwa electronic instrumental osu!,98,2,103.44489795918368,1525573,0.0096669823232323
Heart Realize (TV Size),Tia,browiec,noragami supercell ryo ending japanese anime pop jpop j-pop,15,3,93.168,1525595,0.0214665979735531
ambiguous (TV size),GARNiDELiA,Umi,キルラキル opening xChippy matoi ryuko kiryuin satsuki studio trigger meg rock,44,3,88.81629166666667,152786,0.0225183911923065
Breach,M2U feat. NICODE,Okoratu,electronic instrumental okorin neqoo krimek sylvarus English Video Game,83,2,110.99425,1529336,0.0090094757160843
