title,artist,creator,tags,num_timing_points,num_uninherited_points,mp3_duration_seconds,song_name,variation_rating_uninherited
Ju Tou San Chi Tian Qi Qing,Paroto,CrystilonZ,Nekojishi jiā yǒu dà māo jia you da mao mau Nviek5 KuensanP クエン酸P 晴空和音 Triodust 空氣載體 furry ezek HappyRocket88 BoatKrab KittyAdventure Shiroi Hiroshi gokugohan12468 collaboration 鸚鵡 ajeemaniz exusagi Nwolf Kaitjuh Parrot A Sunny Day is Watching over You (Vocal) Arzenvald,8,3,93.53333333333332,495866,0.0213827512473271
On And On,Utada Hikaru,Strawberry,This is the one Bakemonogatari Senjougahara Hitagi,47,3,118.98775,49595,0.0168084529709991
Wo Zhen De Shou Shang Le,Hollow Wings,Hollow Wings,张学友 Jacky Cheung 热 王菀之 Ivana 中国香港 Hong Kong fanzhen0019,96,96,204.7595,496930,0.4639589371921693
Owari no Sekai Kara (Short Ver.),yanaginagi,jesse7419,Jun Maeda Yanagi Nagi Saya-Honmei,47,3,105.38329166666666,49804,0.0189783405734384
Koiseyo Otome!,Yonekura Chihiro,Kencho,Smug Nanachi sodarose -Eriri- Mimari SnowNiNo_ Narcissu Lavender yf_bmp Skystar Amamiya Yuko sabbat of the witch yuzu soft visual novel eroge hentai opening sanoba japanese video game,107,2,244.70158333333333,498438,0.0040866102555527
DREAM SOLISTER (TV Size),TRUE,Nevo,Hibike! Euphonium opening Shiratoi Yamicchi Linada WORSTPOLACKEU Renumi Agatsu ShogunMoon [[Pika]] armin a_r_m_i_n FoxyGrandpa Shunao,77,9,92.57795918367349,499482,0.0864136568848758
"Scooby-Doo, Where Are You?",Larry Markes,ezek,Hanna-Barbera XinCrin,31,29,62.57125,50063,0.4474898615578241
Insaengui Huejeonmongma(ppongjjak ver.),Pianom,jieusieu,ハウルの動く城 ジブリ 人生のメリーゴーランド Howl's Moving Castle Merry Go Round of Life Ghibli Happil Enon Kaburagi Kotetsu bbj0920,19,2,121.59475,50074,0.0082240392780115
Pop It,Anamanaguchi,Bonsai,Pop_It feat. meesh彡☆ Electro Chiptune Bitpop idk,62,3,223.44773242630384,501677,0.0089506390522876
Six Trillion Years and Overnight Story,IA,tutuhaha,vocaloid vocaloid3 spboxer3,75,13,219.9893333333333,50258,0.0545480993017843
Zen Zen Zense,Gom (HoneyWorks),MugiwaraSekai,kalibe sotarks pkhg kimi no na wa your name makoto shinkai 新海 誠 Oji RADWIMPS cover 歌ってみた,16,13,31.81714285714286,503141,0.3771551724137931
Ai o Chikaishi Hime Kazari,Ayalis,handsome,vocaloid gumi あやりす ayarisu kyshiro captin1 toybot ascendance,83,6,260.1273333333333,506155,0.0192213556950314
Kamiiro Awase,binaria,Chaoslitz,danganronpa hope's peak academy side despair tv size yanaginagi annabel mackenzie rizia kawaiwkyik pata_mon,66,9,89.1,506771,0.0897867564534231
Savior,Rise Against,pishifat,punk metal appeal to reason milan- smokeman fieryrage raiden,51,7,191.19554166666663,509675,0.0313814848803352
Hit The Floor,Bullet For My Valentine,FCL,bfmv the poison metalcore melodic metal slayed alternative english,60,10,159.76489795918368,509762,0.0563327746893394
Recall THE END (Anime ED Version),TRUSTRICK,Chaoslitz,-Kazuto gokugohan12468 KittyAdventure No_Gu Karen Kibougamine Gakuen Mirai Hen danganronpa dangan ronpa ed The End of Hope's Peak Academy,45,13,90.684,509808,0.1323276432446738
Sakebe,Manami Numakura,Meg,Mahou Shoujo Ikusei Keikaku Magical Girl Raising Project tv size まほいく Mahoiku iMage-- Akitoshi Kanau fuyuyu- Mamayu Doormat ShiraKai kaCha Koiyuki Minakami Yuki,6,2,90.432,511055,0.0110580325548478
Hikari no Hahen,Takahashi Yu,handsome,オレンジ anime opening version tv size,18,6,89.10367346938776,511758,0.0561144092641454
Recall THE END (Anime ED Version),TRUSTRICK,Anxient,Danganronpa 3 Hopes Peak Academy Kibougamine Gakuen Kibou Hen Future Side Arc ailv,23,13,92.72244897959185,511989,0.1294184971607166
cross the line,AKINO with bless4,Shad0w1and,Shuumatsu no Izetta Last Witch Lasse Kibbleru HabiHolic Misure Doormat Little CloudSplash16 Hey lululu,15,4,89.964875,513457,0.0333463476717996
Slip Away,The Prototypes,Secretpipe,dnb drum and bass C00L Nerova Riuz GX Kin Kyshiro Zerss phaZ,102,11,211.5134693877551,518278,0.0472783129554155
Hito ni Yasashiku,THE ROLLING GIRLS,Pata-Mon,Lyric Rizia kawaiwkyik Sadism-Bread 小澤亜李 Ozawa Ari 日高里菜 Hidaka Rina 種田梨沙 Taneda Risa 花守ゆみり Hanamori Yumiri THE BLUE HEARTS Anime OP opening tv size,20,8,201.56079166666663,518359,0.0347289765143229
Last Ride of the Day,Nightwish,pw384,Imaginaerum Symphonic Metal Rock Power Gothic English 384059043 EncoreW tm1209 Odaril Shiro Muziyami,123,10,272.56695833333333,518695,0.0330194094509193
Once Upon A Time,Warak,Xilver,rhythm mobile game story telling undeadcapulet -pc,75,4,177.03183673469388,519154,0.0169461044710048
No title,R3 Music Box,sahuang,Giga-P gigap REOL feat. Hatsune Miku れをる 初音ミク cellina doyak left,7,7,51.879183673469385,520938,0.1156533232628398
Kokuhaku (TV Size),supercell,Netsukawa,koeda ending ryo nich95 bestz2541 No_Gu NoGu climbb65588 hichman,14,5,92.29061224489796,52228,0.0433413529578262
Shelter,Porter Robinson & Madeon,Monstrata,snownino_ battle umi liiraye secretpipe andrea osuplayer111 gero pho milan- rumia- sukinathan vinxis kibbleru rin edm electronic dance music a-1 pictures crunchyroll collaboration,225,75,341.08616666666666,522857,0.2169539759503586
Shelter,Porter Robinson & Madeon,pishifat,,307,75,341.0600416666667,527661,0.2169705944982072
Nobore! Susume! Takai Tou,KikuoHana,Karen,"きくお, 花たん, Hanatan, YURiCa, 第一幕, Daiichimaku, SCGA-00045, Azure",135,18,318.93429166666664,528821,0.0533025154214759
Asterism,ChouCho,Sotarks,Prisma☆Illya 3rei op opening anime loli pkhg,19,3,89.04931972789116,532550,0.0224594641049636
Kuusou Ressha,Wolpis Kater,Sonnyc,orangestar daydream sky train Karia Left Dailycare Morinaga island,31,18,247.04,532596,0.0688147668393782
AIWAGUMA,illion,Ellyu,UBU Yojiro Noda 野田洋次郎 Folk Rock _Yiiiii Pata-Mon Tenshichan Superstar Tofu1222 Antalf handsome muscle,41,4,226.4033333333333,533037,0.0132506882996422
Angelus (TV Size),Shimatani Hitomi,Kei,opening Snepif sunrise entertainment dance dance revolution supernova 2,16,8,129.044875,53834,0.0542446958858304
Kawaranai Sora (TV-version),Luck Life,Battle,Junjou romantica bl boys love rock yaoi ed ending shounen ai,39,13,96.99265306122447,538417,0.1237207110153514
Victims of Contingency,EPICA,DakiniBrave,Metal Symphonic The Quantum Enigma dutch english metal rock guitar drums orchestra fizz smug smug- lmt dereban dendy dendyhere,42,5,211.2522448979592,540457,0.0189347100284407
Niji,SHINKU-HOROU,Seto Kousuke,Shinkuu Shinku Horou Hollow Vacuum Anime Japanese Ending Single Short Version Naruto Shippuden Wakatten dayo Trynna,17,6,112.09675,542076,0.0446043261735955
Kimi to Gelaende,SHISHAMO,Zero__wind,rock indie iYiyo,27,4,258.14204166666667,543243,0.0116215087656036
Distance (m-flo remix),Utada Hikaru,IchiGUN,kosiga -bakari- haruka hinsvar sweet_serenitee,7,3,144.14895833333333,54386,0.0138745366121561
Uso (TV Size),SID,Nevo,ed version ending 1 anime shounen japanese pkhg enkrypton brotherhood Stixy,7,3,91.36433106575964,544412,0.0218903808156872
Phase 1,Beatdrop,rickyboi,DANCETRAX _SPAM PERFECTASYMMETRY,27,3,128.70529166666665,54511,0.0155393766184827
Loose Change,Royal Blood,BOUYAAA,Hard Rock Metal HootOwlStar Rohit6 Exote,24,5,156.5257142857143,545156,0.025554906542056
Brain Power,NOMA,Monstrata,rizen a q p w nhawak kuron-kun gero doormat dailycare rohit6 haruto haruto_aizawa pentori snownino_ sdvx museca,34,4,116.95554166666666,546384,0.0256507725692063
Hikari,RADWIMPS,Haruto,Light Human Bloom 人間開花 Ningen kaika short cut version haruto_aizawa monstrata ipas newipas appleeaterx milan- rizen kalibe sotarks sytarno irohas mugiwarasekai a q p w a_q_p_w kimi no na wa nawa 君の名は。 your name,11,6,144.175125,547714,0.0346800462285016
INVOKE (TV opening version),T.M.Revolution,Lily Bread,mobile suit Gundam Seed strike freedom,10,3,96.01275,549719,0.0208305667736837
Vena,coldrain,Sharkie,metalcore metal post-hardcore Fizz,20,6,59.01061224489796,550046,0.0847305223550243
Sakebe,Manami Numakura,Mishima Yurara,Mahou Shoujo Ikusei Keikaku Magical Girl Raising Project まほいく Mahoiku Little Cloudsplash16 doormat depths Kalibe Curi [C_u_r_i] sahuang my angel azusa gaia pkk CelsiusLK -[Koinuri] Koinuri Mikii RLC VINXIS Delis,45,2,248.4,550344,0.0040257648953301
Frey's Philosophy,Powerless,My Angel Azusa,sahuang pentori kalibe kanau hakurei yoru flask boss song rhythm game,32,4,138.67733333333334,550588,0.0216329513114375
Zettai Reido Novatic,WALKUERE,Pentori,macross delta walkure trap,43,5,201.39027210884356,552252,0.0198619325457694
YoiYoi Kokon,REOL,Ongaku,jbhyperion mrsergio mir sigma giga,57,2,94.94299319727892,552854,0.0105326361253655
Zauberkugel,xi,pishifat,magic bullet Agartha Progressive Jazz Electronic,131,2,114.709,554892,0.0087177117750132
Yuudachi no Ribbon,Kano,Sotarks,みきとp mikitop vocaloid utaite cover evening shower arumachi no hakuchumu cut ver short kalibe janpai akitoshi corinn doormat chromoxx,10,3,103.3926530612245,556174,0.0193437342091965
Gabriel Drop Kick,"Tomita Miyu, Onishi Saori, Ohzora Naomi, Hanazawa Kana",Doormat,Kalibe Little CloudSplash16 dropout gabdro dropkick ガヴドロ opening tv size tenma gabriel white 天真・ガヴリール・ホワイト tsukinose vignette april 月乃瀬・ヴィネット・エイプリル vigne ヴィーネ kurumizawa satanichia mcdowell 胡桃沢・サタニキア・マクドウェル satania サターニャ shiraha raphiel ainsworth 白羽・ラフィエル・エインズワース,40,8,89.62612244897959,556393,0.0781022296706499
Hallelujah*Essaim,"Tomita Miyu, Onishi Saori, Ohzora Naomi, Hanazawa Kana",Doormat,Karen Kisses Akitoshi Corinn Kibbleru Kalibe [_-Scarlet-_] Pentori dropout gabdro ガヴドロ ending ed tv size tenma gabriel white 天真・ガヴリール・ホワイト tsukinose vignette april 月乃瀬・ヴィネット・エイプリル vigne ヴィーネ kurumizawa satanichia mcdowell 胡桃沢・サタニキア・マクドウェル satania サターニャ shiraha raphiel ainsworth 白羽・ラフィエル・エインズワース,38,6,89.88734693877551,559248,0.0556251816332461
Inai Sekai,Primary,Lasse,yuikonnu yuiko meis clauson 8th single aster tataricus Kalibe Momochikun Logic Agent DarkVortex Chromoxx asuasu_yura Nwolf,211,3,196.8,560389,0.0101626016260162
Little Busters! -TV animation ver.-,Rita,Nyquill,Makar xCherry Makar8000 Xakyrie Haruka sweet_serenitee opening jonathanlfj key,6,5,99.13466666666666,56259,0.0403491546852093
High Free Spirits vs. DREAM SOLISTER,TrySail & TRUE,Sotarks,High School Fleet ハイスクール・フリート はいふり Hai-Furi haifuri 麻倉もも 雨宮天 夏川椎菜 響け! ユーフォニアム hibike euphonium opening op irohas mugiwarasekai xinely akitoshi corinn davided linada pentori chromoxx garden left haruto haruto_aizawa hobbes2,24,7,115.892,564534,0.0517723397646084
Gabriel Drop Kick,"Tomita Miyu, Onishi Saori, Ohzora Naomi, Hanazawa Kana",wcx19911123,Curisu yangzd88 Dropout Dropkick TV Size opening 天真 ガヴリール ホワイト Tenma White 月乃瀬 ヴィネット エイプリル Tsukinose Vignette April 胡桃沢 サタニキア マクドウェル Kurumizawa Satanichia McDowell 白羽 ラフィエル エインズワース Shiraha Raphiel Ainsworth,38,8,89.62612244897959,566465,0.0781022296706499
Ben Se,Ling Yuan yousa,09kami,古风 十个HTT呀啦索 怎么说呢 冷鸟 chinese Crystal 小语 洛天依,76,25,314.67102040816326,567325,0.0762701311638718
haze,TK from Ling tosite sigure,Ametrin,flowering misure,78,30,238.90392290249437,568305,0.1213877095347487
Outside of Melancholy ~Yuuutsu no Mukougawa~,fhana,Sotarks,lantis Junichi Sato yuxuki waga kevin mitsunaga towana zerss,94,20,188.5257142857143,568455,0.1007820077594568
Stay Alive,EMILIA(CV: Rie Takahashi),Kyuukai,re: zero kara hajimeru isekai seikatsu life in a different world from re:zero tv size ed ending metaku hazu- yaleufeu,29,4,90.024,568865,0.0333244468141828
Champion no Ayaya,Momiage Pudding,Linada,lcfc Kyuukai Eimi Fukada yaleufeu nevir NEVlR LowComboFC Akitoshi GoldenWolf woof きんいろモザイク Kinmosa Kiniro Mosaic Pokémon Pokemon champion battle novelty japanese kin mad meme pocket monsters red heart gold hg soul silver ss crystal lance gen2 video game freak nintendo gowo,139,5,97.931768707483,569620,0.0408447641944238
Catch the Moment -Radio Edit ver.-,LiSA,Shad0w1and,SWORD ART ONLINE The Movie - Ordinal Scale - SAO Lami intoon Kawaiwkyik Rizia Moecho Moeri Doormat Flask Kisses,42,3,127.36544217687074,570938,0.0157028465949391
AMAZING BREAK,TERRASPEX,Monstrata,テラフォーマーズ appleeaterx hobbes2 deppyforce derandom_otaku,112,8,234.97142857142856,571835,0.0297908560311284
Gabriel Drop Kick,"Tomita Miyu, Onishi Saori, Ohzora Naomi, Hanazawa Kana",Okoratu,anime dropout gabdro dropkick ガヴドロ opening tv size tenma gabriel white 天真・ガヴリール・ホワイト tsukinose vignette april 月乃瀬・ヴィネット・エイプリル vigne ヴィーネ kurumizawa satanichia mcdowell 胡桃沢・サタニキア・マクドウェル satania サターニャ shiraha raphiel ainsworth 白羽・ラフィエル・エインズワース Okorin Feerum Nardoxyribonucleic Sc4v4ng3r Scavanger,89,6,89.62612244897959,572809,0.0557873069076071
Catch the Moment,LiSA,Delis,sword art online sao movie ordinal scale asuna Dagger-Gazel Satellite,108,46,282.88,572897,0.1590780542986425
Haryu,Azu,milr_,Taiko no Tatsujin Down electronic instrumental video game ソライロ sorairo ver. version オリジナルサウンドトラック やきとうもろこし 第2弾 original soundtrack yakitoumorokoshi daini-dan dainidan second edition,58,8,131.21333333333334,576232,0.0533482369677878
Boku no Friend,Mewhan,VINXIS,Kemono Friends ED ending Sand Cat スナネコ meyrink Karen,8,2,90.09716666666668,576482,0.0110991281634827
Gabriel Drop Kick,"Tomita Miyu, Onishi Saori, Ohzora Naomi, Hanazawa Kana",Doormat,Kalibe SnowNiNo_ Karen dropout gabdro dropkick ガヴドロ opening full size tenma gabriel white 天真・ガヴリール・ホワイト tsukinose vignette april 月乃瀬・ヴィネット・エイプリル vigne ヴィーネ kurumizawa satanichia mcdowell 胡桃沢・サタニキア・マクドウェル satania サターニャ shiraha raphiel ainsworth 白羽・ラフィエル・エインズワース,103,22,214.30857142857144,576517,0.0979895477815699
clever -TV MIX-,ClariS x GARNiDELiA,Trust,qualidea code ending captin1,15,6,93.3877551020408,578231,0.0535402097902097
Shinsou,Tsubaki = Yayoi (CV: Imai Asami),Seikatu,赤尾でこ Akao Deko 石渡太輔 Ishiwatari Daisuke 佐藤ノリチカ Sato Norichika Deep Blue Azure,108,9,276.98938775510203,579130,0.0288819729334653
Kimi ni Todoke,Tomofumi Tanizawa,Kyuukai,sawako ponoyoshi shyotamaze yaleufeu from me to reaching you opening,27,3,60.0,580001,0.0333333333333333
dorchadas,Rita,Delis,milkshake trynna alacat mirash Meaning blueberry yoghurt yogurt Shikkoku no Sharnoth,29,6,280.05879166666665,580215,0.0178533941757169
Brave Freak Out -TV ver.-,LiSA,_DT3,Qualidea Code OP Opening Risa Oribe Tomoya Tabuchi Koichiro Takahashi 10th Single ShogunMoon Astarte Mir LCFC LowComboFC Plaudible Lasse A_r_M_i_N Armin Kibbleru,119,3,89.65224489795918,582520,0.0223084207459207
Catch the Moment -Radio Edit ver.-,LiSA,imbor,sao sword art online the movie ordinal scale sotarks naotoshi lilyanna realazy Dashyy- Mir nao tomori real,45,3,127.36544217687074,584079,0.0157028465949391
Nippon Egao Hyakkei,Momokurotei Ichimon,Kyuukai,Ending Momoiro Clover Z Joshiraku Rakugo Girls Linada Hazu- Akitoshi Corinn Yaleufeu,53,3,90.0,584520,0.0222222222222222
"NO RAIN, NO RAINBOW",BABYMETAL,Hysteria,j-pop j-rock pop rock kawaii heavy metal resistance su-metal yuimetal moametal lazyboy007 tokiko nao tomori naotoshi Joe Castle yShadowXOP_,577,15,293.12,585019,0.0477620087336244
Zenbu Kimi ga Ita kara Shittanda,Suzuki Konomi,Kalibe,komore schoolboy collaboration mugiwarasekai irohas haruto haruto_aizawa tenka hyakken mobile game,138,4,259.968,587616,0.01153988183161
We Can!,Kishidan to Kitadani Hiroshi,iYiyo,opening 19 zou toei animation pirates Atsuro Hazu- Irohas MugiwaraSekai,60,14,150.216,588256,0.0865420461202535
Alice in Misanthrope -Ensei Alice-,LeaF,Murasaki Nova,BOFU2016 - Legendary Again 想起 GOTHIC CHOIR セシル◇タイト Fouriose 孤高クローバー,55,19,146.29643990929705,588475,0.1230378539023909
Main Theme - Dubstep Remix,Lucas Fader,Strategas,sony playstation drum and bass drumstep dubstep game Universal Interactive Studios My Angel Azusa sahuang,539,7,184.73795918367347,588976,0.0324784360859728
Genzaichi,fhana,Sotarks,青空のラプソディ junichi sato yuxuki waga kevin mitsunaga Lantis Akitoshi Corinn aozora no rhapsody single edition,36,36,105.28160997732428,590023,0.3324417246994832
a e i u e o ao!!,Gekidan Hitotose,alacat,Opening Hinako Note Rare 桜木ひな子 Sakuragi Ｍ・Ａ・Ｏ 市道真央 Ichimichi Mao 夏川くいな Natsukawa Kuina 富田美憂 Tomita Miyu 柊 真雪 Hiiragi Mayuki 小倉唯 Ogura Yui 萩野千秋 Hagino Chiaki 東城日沙子 Hisako Tojo 中島ゆあ Nakajima Yua 高野麻里佳 Kouno Marika,24,11,89.88734693877551,591255,0.1112503632664923
Real World,nano.RIPE,bakabaka,Evil_Twilight,67,9,209.59991666666667,59269,0.0381679541062158
Marigold (ft. Guriri),M2U,- Frontier -,rayark magnolia myosotis alternate story symphonic boss song piano violin dnb drum'n'bass drum and bass Samsara Collection Diversity forgotten hourglass 3.0 SQUARE-MUSIQ TMDC @ SQ Lab nicode narae 구리리 boatkrab [_lost_] shockolatte -_frontier_- KittyAdventure gokugohan12468,75,6,153.5218,594884,0.0325686645153978
Nippon Egao Hyakkei,Momokurotei Ichimon,Kite,ending nyquill cilvery loctav yia Rakugo Girls Koji Kumeta Yasu J.C. Staff Marii Buratei Kigurumi Harokitei Tetora Bohatei Gankyo Kurubiyutei Kukuru Anrakutei Ayane Sakura Kotori Koiwai Nozomi Yamamoto Yoshino Nanjo Saori Goto Tsutomu Mizushima Masaru Yokoyama MBS,45,4,159.22571428571428,59569,0.0188411778427748
Zoetrope,yanaginagi,Realazy,Akitoshi _83 pyroflayer borborygmos bor yaleufeu Kyuukai Linada Kin エウアル euaru アムネシア opening,28,8,89.92283333333333,599195,0.0778445222477791
adrenaline!!! -TV Ver-,TrySail,Left,Eromanga Sensei ED Ending Linada Karen Gaia toybot Kisses,17,2,88.266,600297,0.0113293907053678
Taiyou to Kurashite Kita,JYOCHO,dsco,math rock flute indie midwest emo uchu conbini だいじろー 祈りでは届かない距離 宇宙コンビニ a life with the sun,16,16,236.20024943310656,600881,0.0635054367470009
Pastel Subliminal,a_hisa,Albatro,1st Album Colors Spiritual Core Aihara Hisa,225,3,283.8465306122449,603051,0.0070460611080434
My Sweet Maiden (TV-size),Mia REGINA,Mir,Seven Mortal Sins Nanatsu no Taizai Flezlin borborygmos bor pyroflayer _83 anime,22,4,90.80141666666668,606419,0.0330391320987099
Hitokoto no Kyori,*namirin,Kroytz,M3-39 5colors utaite kalibe sharkie gaia haruto haruto_aizawa sotarks doormat,81,2,100.09469387755102,609569,0.0099905395706922
"Daisuki, Evolution",Minazuki Airi with Atsushi,Syph,Kan詰め 斬戯 visual novel dating simulator game opening song josou gakuen eroge traps xexxar xr karen akitoshi corinn jogaku no strike,32,3,100.32864583333334,611004,0.0199344861418982
Hikaru Nara,Poppin'Party,A s h e m u,A_s_h_e_m_u Ashemu Gaia Goose house Toyama Kasumi Hanazono Tae Ushigome Rimi Yamabuki Saaya Ichigaya Arisa Aimi Otsuka Sae Nishimoto Rimi Ohashi Ayaka Itou Ayasa 愛美 大塚紗英 牛込 りみ 山吹 沙綾 市ヶ谷 有咲 BanG Dream Girls Band Party! Bandori Video Game Japanese Cover 四月は君の嘘 Shigatsu wa Kimi no Uso Your Lie in April Anime Opening OP ポピパ PoPiPa Game ver,19,2,114.459,611024,0.0087367528984177
MELODY FLAG,Inori Minase,Chirony,中野領太 ryota nakano,54,27,285.7795918367347,613403,0.0909792047531992
Becoming Popular,Daniel Ingram,CDFA,Kazumi Evans Rarity mlp,17,16,110.23733333333334,61551,0.1360700549118266
birthday song,Sayuri,Haruto,mikazuki no koukai album RLC xlni val0108 fanzhen0019 handsome professionalbox probox asphyxia shirakai kacha kibbleru narcissu appleeaterx haruto_aizawa sing kalibe pentori sotarks akitoshi -laura- corinn doormat kroytz -sh1n1- shini toybot milan- irohas mugiwarasekai linada,115,7,317.1526530612245,616185,0.0189183345688164
Hyakka Ryouran,ITO KASHITARO,appleeaterx,milan- kanor itou kashitarou うつくしまYOSAKOIまつり　おもてなし温楽彩,230,2,285.888,617188,0.0034978732930378
Face Down,The Red Jumpsuit Apparatus,theramdans,don't dont you fake it pop punk post-hardcore emo Universal Music Publishing Group English Rock Akitoshi Pyrozen Yato3o -Laura- Corinn,43,2,189.93632653061223,619824,0.0052649222940448
Nevereverland,nano,zhu,naoki itou n neko アークix nifty cordi victorfernando -tochi starset hb24 short version,20,5,139.9640625,621438,0.0285787646382441
Katayoku no Tori,Shikata Akiko,IceKalt,opening japanese blue 古戸 ヱリカ furudo erika umineko no naku koro ni sakurauchi_riko phyloukz imoutosan fushimi_rio loreley namki italian 波乃 渉 namino wataru,331,7,279.32733333333334,622500,0.0214801749918256
Kamisama ni Natta Hi,REOL,Mentai,japanese pop electronic the day i became a god sparhten cyndere amiya sigma,46,8,245.1330612244898,623748,0.0285559196504688
Vidro Moyou (QL Tell Your World Mashup),yanaginagi,- t e n n y a -,remix tell your world kz(livetune) hatsune miku vocaloid Laurier inverness QubicLoop Flask mintong89 those,26,3,115.80698412698412,62440,0.0172701155727099
again,YUI,_83,fma tv size opening bor hagane no renkin jutsushi,36,7,97.52396825396823,625048,0.0615233373643597
MALFORMED BOX / INSIDE BEAST,the GazettE,Vell,visual kei ruki uruha aoi reita kai beautiful deformity greenshell darky1,305,4,317.2624583333333,627671,0.0094558934446887
-ERROR,Ribonnu,Toumei Dragon,guineaQ aigoh milr_ Left HabiHolic Reillia curi jieusieu [_white_music_] [c_u_r_i] down [_kuro_usagi_] [ kuro usagi ] japanese 歌い手 Utaite niki Vocaloid Lily rock,94,2,240.04789115646255,628446,0.0041658353888566
in the Garden,Primary,Kyuukai,yuiko yuikonnu album Meis Clauson shogunmoon yaleufeu owens pono ponoyoshi momochikun,150,4,117.9263492063492,629217,0.0254396071801608
Hoshikuzu Venus,Aimer,Kyuukai,夏雪ランデブー Rendezvous A Summer Snow rendez vous Anata ni Deawa Nakereba Natsuyuki Fuyuhana あなたに出会わなければ 夏雪冬花 single anime kalibe modem hazu- shogunmoon エメ,47,5,127.29197916666666,629373,0.0314238181084661
ChRoNiClESeVeN feat. Annabel,sasakure.UK,Delis,7th dragon III RLC VINXIS Chromoxx Arrival,49,25,285.100375,630014,0.0841808784011595
Shadow gate to love,Guilty Kiss,Kisses,Left Karen Dream117er Nardoxyribonucleic ラブライブ！サンシャイン!! love live school idol project suzuki aina 鈴木愛奈 aida rikako 逢田梨香子 kobayashi aika 小林愛香 ohara mari 小原鞠莉 ギルティキス,13,2,103.34040816326532,630109,0.0096767568250758
Still Take You Home,Arctic Monkeys,Milan-,rock alternative punk garage blues whatever people say that's what i'm not bouyaaa,58,9,141.41868480725623,631466,0.0565696110871306
Haruka Kanata,ASIAN KUNG-FU GENERATION,Monstrata,naruto uzumaki sasuke uchiha sakura haruno kakashi hatake opening two 2 tv size kungfu musty -sh1n1- sh1n1 shini neoskylove gero alacat lit120 -hakurei-,44,39,89.81433333333334,632128,0.4230950516435758
Curtain Call!!!!!,Gekidan Hitotose,Left,Hinako Note ED Ending fieryrage Crystal Akitoshi,22,6,89.67836734693877,633693,0.055754806291873
Kotoba no Iranai Yakusoku,sana,Irohas,mugiwarasekai 鎖那 honeyworks shippuden shippuuden ending gom oji 海賊王 shito cake atsyuk! ヤマコ,40,4,254.06695833333333,634179,0.0118079108738887
One In A Billion,"Wake Up, May'n!",Meg,"Isekai Shokudou Restaurant to Another World Wake Up, Girls! opening tv size iMage-- zeluaR Momochikun Mei",15,10,89.16,637877,0.1009421265141319
"10% roll, 10% romance (TV Size)",UNISON SQUARE GARDEN,Hazu-,wolf3211 -NanoRIPE- toybot ballroom e youkoso welcome to the opening op anime japanese,48,4,90.36983333333332,639236,0.0331969185882457
Uso - 'Hagane no Renkinjutsushi FULLMETAL ALCHEMIST' ED Ver.-,SID,Pata-Mon,Kencho Anime ED ending tv size,7,3,91.36433106575964,641285,0.0218903808156872
THERE IS A REASON,Suzuki Konomi,Doormat,Kalibe Akitoshi Corinn Gaia no game no life zero 0 movie theme song ngnl nogenora,94,17,291.66383333333334,641718,0.0548576757602788
Zenryoku*Summer! TV Size,angela,AngelSnow,aho-girl ahogaru clueless girl aho op tvsize anime opening baka banana buhei,12,6,60.10775510204082,642379,0.0831839417644502
Fly high,Dreamcatcher,Natsu,지유 수아 시연 한동 유현 다미 가현 Ji-U Su-A SiYeon Handong YooHyun DaMi Gahyeon Happy Face Entertainment Prequel 1st mini album kpop k-pop rock,104,32,211.4612244897959,645657,0.146598980852378
Sequence Start,sungazer,dsco,experimental electronic dnb drum and bass groove time signature instrumental jazz fusion adam neely sun gazer gaze shawn crowder quintuplet,84,83,94.0669387755102,647360,0.8717196612052207
KINGS (TV Size),angela,No_Gu,atsuko katsu Kiiwa S_h_i_o_n Shion opening,85,5,90.18,64779,0.0443557329784874
PLATINUM (Short Ver.),Yuuki Aoi,DJPop,Opening MAD Parody Puella Magi Madoka Magica Kaname Madoka Kinomoto Sakura Kami Nomi zo Shiru Sekai Aoyama Mio SUBSTAC9,133,3,96.83591666666666,64967,0.0206534937536089
Uchiage Hanabi,DAOKO x Kenshi Yonezu,Yasaija 714,hanabi shita kara miru ka? yoko kara miru ka? movie hachi ハチ corinn akitoshi -Laura- Ryuusei aika,44,16,292.72816326530614,654500,0.0512420801356416
Chikyuu Saigo no Kokuhaku o,Mitani Nana,Star Stream,thzz toybot Cah-m Moeka Ra-s Guy winber1 MidSoul Lundlerol qoot8123 kemu vocaloid megpoid gumi nico douga hatsuko suzumu VOCALOID2 歌ってみた,160,4,268.8,65491,0.0111607142857142
